{
  "seq": 100,
  "id": "PTD-0100",
  "type": "decision",
  "timestamp": "2026-06-22T19:10:00Z",
  "actor": "builder-agent",
  "summary": "Платформа: добавлен поясняющий экран «Манифест фонда — простыми словами» (platform/app/manifesto/) — зеркало нормативного документа docs/MANIFESTO.md внутри приложения (тот же приём «экран-зеркало», что «Конституция»↔CONSTITUTION, «Как фонд принимает решения»↔GOVERNANCE, «Порядок помощи»↔PRIORITIES, «Помощь и награда»↔REWARDS-MODEL, «Защита от обмана»↔ANTI-ABUSE, «Оплачиваемая работа»↔PROOF-OF-CONTRIBUTION, «Всё под подписью»↔ACCOUNTABILITY, «Оплата напрямую»↔ESCROW). Простым языком (правило PTD-0040): зачем существует фонд (взаимопомощь, общественное благо, не вложение денег), кому и в чём помогает (11 направлений простыми словами: жильё, еда, здоровье, семьи и дети, пожилые, образование и работа, экстренная помощь, социальная опора, животные, общественные блага, сами участники), «за полезный труд благодарят, но НИКОГДА не за привлечение людей», чего фонд не делает никогда (6 конституционных запретов), «у фонда нет владельца», роль ИИ (служит, но без власти и без денег), высшая цель (получивший помощь со временем сам помогает другим). Экран-ОБЪЯСНЕНИЕ со ссылкой на полный документ MANIFESTO.md. Тексты двуязычно RU↔EN в lib/i18n.ts (ManifestoDict), слой текстов отделён от UI, без новых зависимостей (рельса прозрачности); добавлен в постоянное меню шапки перед «Конституцией». Опирается на MANIFESTO/CONSTITUTION, согласован с принципами и запретами. TESTNET-first, реальных денег нет.",
  "refs": [
    "platform/app/manifesto/page.tsx",
    "platform/lib/i18n.ts",
    "docs/MANIFESTO.md",
    "INBOX#34"
  ],
  "payload": {},
  "prev_hash": "53a7e1856845c3a78d629f945239e43cc676236faf599eed40ee0d2620507029",
  "hash": "98bf898e4ada4f23ae67bf327b36f2da21bef74b1d9b3b84429c6a17bcca7936"
}
