{
  "seq": 88,
  "id": "PTD-0088",
  "type": "decision",
  "timestamp": "2026-06-22T18:45:00Z",
  "actor": "builder-agent",
  "summary": "Платформа: экран «Кому фонд помогает раньше: порядок помощи» (platform/app/priorities/) — зеркало нормативного docs/PRIORITIES.md внутри приложения. Простым языком (правило PTD-0040) объясняет честный порядок: когда денег в казне меньше, чем просьб, чью беду закрывают первой. Ведущий раздел «Главное — простыми словами» (5 опор: сначала жизнь и жильё; помощь по тяжести беды, а не по тому, кто человек; очередь = скорость рассмотрения, а не поблажки в проверке; равные по тяжести — честно и открыто; долгая польза для всех в конце, но не выкинута), затем нумерованный порядок 10 уровней (короткие подписи переиспользованы из apply.priorityLabels, человеческие пояснения — priorities.meanings), «Как это работает на деле», честная плашка «срочность не отменяет проверку», ссылка на экран заявки и на нормативный документ. Слой данных переиспользует PRIORITIES из lib/application.ts (ничего не задвоено), без новых зависимостей (рельса прозрачности: ноль исходящих запросов). Двуязычно RU↔EN (PrioritiesDict в lib/i18n.ts), доступность (секции с aria-labelledby). Добавлен в постоянное меню и связан ссылкой из экрана «Подать заявку». INBOX #34.",
  "refs": [],
  "payload": {},
  "prev_hash": "f7e4c52847d41defe895fda71d12bbf776f387313b6b0cc4e5b9df70d35c7fe2",
  "hash": "0426e800efa9ba5f093ef0a7a85b1e86a14f8785451a3170af060fdaff700812"
}
