{
  "seq": 89,
  "id": "PTD-0089",
  "type": "decision",
  "timestamp": "2026-06-22T18:50:00Z",
  "actor": "builder-agent",
  "summary": "Платформа: подключена ПУБЛИКАЦИЯ платформы на бесплатном GitHub Pages рядом с витриной, не ломая живой сайт. Процесс деплоя (.github/workflows/pages.yml) теперь за один проход собирает и выкладывает два слоя: витрину-лендинг web/ по корневому адресу проекта и полноценную платформу на Next.js по адресу .../app/. Платформа собирается на серверах GitHub (npm install + next build, статический экспорт) с адресом-подпутём NEXT_PUBLIC_BASE_PATH=/<имя-репозитория>/app, снимок открытого журнала пересобирается из реестра перед сборкой (прозрачность: ничего не подгружается со стороны), всё складывается в единую папку _site (web в корень, platform/out в подпапку app) и публикуется одним деплоем (один источник Pages, без конфликта). Триггеры расширены (platform/**, governance/registry/**), чтобы платформа и снимок журнала обновлялись при изменениях. Рельса прозрачности: телеметрия Next off. Это заготовка «до кнопки»: единственное действие оператора — включить GitHub Pages (Settings → Pages → Source: GitHub Actions); после этого витрина и платформа становятся доступны вживую, оператор сможет посмотреть приложение по ссылке .../app/. TESTNET-first, реальных денег нет. Закрыт последний открытый подпункт INBOX #34 (публикация платформы на Pages при переходе с web/).",
  "refs": [
    ".github/workflows/pages.yml",
    "platform/",
    "INBOX#34"
  ],
  "payload": {},
  "prev_hash": "0426e800efa9ba5f093ef0a7a85b1e86a14f8785451a3170af060fdaff700812",
  "hash": "0de93be7bc603036a0151e35b9fd26fca5eefa5b56f35fffbccca8a14d4ce3ab"
}
