{
  "seq": 103,
  "id": "PTD-0103",
  "type": "decision",
  "timestamp": "2026-06-22T22:30:00Z",
  "actor": "builder-agent",
  "summary": "Платформа: на главной визуально отделён блок объяснений от блока рабочих экранов (platform/app/page.tsx + globals.css). Раньше обе секции главной (шесть рабочих экранов и одиннадцать экранов-объяснений) использовали один визуальный приём (screen-grid/screen-card с акцентной «рабочей» рамкой), и человек мог перепутать объяснение с действием. Теперь секция «Разобраться, как устроен фонд» — это мягко тонированная панель (фон surface-2, рамка, скругление) с меткой-подсказкой «Чтение, а не действие» рядом с заголовком, а её карточки получили нейтральную пунктирную рамку вместо зелёной акцентной (которая на главной означает «готовый рабочий экран»). Так глаз сразу отличает «это объяснения» от «это действия». Чисто-CSS + один новый текстовый ключ learnHint, двуязычно RU↔EN (lib/i18n.ts), слой текстов отделён от UI, без новых зависимостей и без новых обещаний (рельса прозрачности). Закрывает P3-идею роадмапа «Визуально отделить блок объяснений от блока рабочих экранов на главной». TESTNET-first, реальных денег нет.",
  "refs": [
    "platform/app/page.tsx",
    "platform/app/globals.css",
    "platform/lib/i18n.ts",
    "docs/ROADMAP.md"
  ],
  "payload": {},
  "prev_hash": "6938085d8f97463efc74af04bd30225c3a204932fcb5423b5a7ce6442e85cc30",
  "hash": "601bfaecc2838773cf86468a402e2d972b38f6b33b6b77343c145facdf1ccef9"
}
