{
  "seq": 43,
  "id": "PTD-0043",
  "type": "decision",
  "timestamp": "2026-06-22T10:25:00Z",
  "actor": "builder-agent",
  "summary": "INBOX #19 — продолжение прохода «понятный язык»: docs/ANTI-ABUSE.md (+EN) переписан по образцу REWARDS-MODEL/GOVERNANCE — ведущий раздел «Главное простыми словами» (быть честным выгоднее обмана + 9 опор + репутация), жаргон (multisig, circuit breaker, events, Audit/Guardian/Fairness AI) вынесен в «Технический раздел — для разработчиков». Смысл защиты не изменён. INBOX #19 остаётся открытым.",
  "refs": [
    "docs/ANTI-ABUSE.md",
    "docs/en/ANTI-ABUSE.md",
    "comms/INBOX.md"
  ],
  "payload": {
    "decision": "INBOX #19 (понятный язык везде) — продолжение прохода: docs/ANTI-ABUSE.md (+ EN docs/en/ANTI-ABUSE.md) переписан по образцу REWARDS-MODEL/GOVERNANCE. Человеческий заголовок «Как фонд защищён от обмана и воровства», ведущий раздел «Главное — простыми словами» (главная мысль «быть честным выгоднее, чем обманывать» + 7 пунктов: по частям, ограничитель на крупные суммы, никто не решает один, всё видно, стоп-кран без права вывода, репутация помогает но не даёт власти и не отменяет нужду, право обжалования). Девять опор защиты и блок про репутацию даны простыми словами. Жаргон вынесен в «Технический раздел — для разработчиков»: multisig, circuit breaker, events, роли executor/guardian, Audit/Guardian/Fairness AI, ссылка на Treasury.sol/Disbursement.sol. Смысл защиты не изменён. INBOX #19 остаётся открытым (следующие кандидаты: PROOF-OF-CONTRIBUTION, ESCROW-TARGETED-DISBURSEMENT, PRIORITIES).",
    "rationale": "Открытый пункт оператора INBOX #19 — высший приоритет. ANTI-ABUSE.md был нормативным документом без ведущего объяснения простыми словами и с английским жаргоном в основном тексте (multisig, circuit breaker, events, Audit/Guardian/Fairness AI), что противоречит конституции (ст. 3 «понятность», ст. 6 «объяснимость»). Переписан по уже зарегистрированному сквозному правилу PTD-0040 и образцу REWARDS-MODEL (PTD-0038)/GOVERNANCE (PTD-0042): сначала простыми словами, техника ниже. Все содержательные механизмы защиты (поэтапность, лимиты, коллективная проверка, открытость, аудит, апелляции, репутационные санкции, заморозка, исключение) и жёсткие границы репутации (не купить, не за привлечение, не даёт власти) сохранены без изменений.",
    "deliverables": [
      "docs/ANTI-ABUSE.md — переписан по-человечески: ведущий раздел «Главное — простыми словами», девять опор и репутация обычными словами, требования к контрактам и ИИ-агентам в «Техническом разделе — для разработчиков»",
      "docs/en/ANTI-ABUSE.md — EN-зеркало по той же структуре (plain words first, Technical section for developers)",
      "governance/ipfs/manifest.json — пересобран (docs/ANTI-ABUSE.md изменён), verify=OK",
      "governance/registry/ — запись PTD-0043 (type=decision)"
    ],
    "rails": [
      "Понятность как конституционное требование (ст. 3/6): человеку — простой язык, разработчику — техраздел; смысл механизмов защиты не изменён",
      "Жаргон убран из основного текста: multisig → общий кошелёк с несколькими подписями; circuit breaker → стоп-кран; events → публичные записи о движении денег; Audit/Guardian/Fairness AI пояснены как советники, не власть (ст. 9)",
      "Содержательные рельсы не тронуты: поэтапность, лимиты, коллективная проверка, никто не одобряет себе, пауза без права вывода, репутация вспомогательна и не отменяет приоритет нужды, запрет платы за привлечение (анти-пирамида)",
      "Двуязычность RU↔EN в одном коммите",
      "INBOX #19 остаётся открытым: проход продолжается, следующие кандидаты — PROOF-OF-CONTRIBUTION, ESCROW-TARGETED-DISBURSEMENT, PRIORITIES"
    ],
    "status": "adopted",
    "spec": "docs/ANTI-ABUSE.md",
    "advances_inbox": 19
  },
  "prev_hash": "48498de3a798752c109dbe92ced50a56279ec56836076b19f68a3d0e72737667",
  "hash": "5264e164d69c7f1249a08247f2a1483c1c5a048e3315041de2fb065723d8973b"
}
