{
  "seq": 27,
  "id": "PTD-0027",
  "type": "decision",
  "timestamp": "2026-06-22T11:30:00Z",
  "actor": "builder-agent",
  "summary": "Этап 6 (AI-агенты), модуль 7/8: Governance-агент. governance_agent.py — read-only проверка жизненного цикла предложения в конфигах управления (Snapshot space.json + Safe safe.config.json): 1ч=1голос/срок/off-chain-сигнал/привязка к конституции/мультисиг 3-из-5; НЕ голосует. Тест-инвариант test_governance.py (26/26). CI расширен. TESTNET-ONLY.",
  "refs": [
    "ai-agents/governance_agent.py",
    "ai-agents/test_governance.py",
    ".github/workflows/ai-agents.yml"
  ],
  "payload": {
    "decision": "Этап 6 (AI-агенты), модуль 7/8: Governance-агент. ai-agents/governance_agent.py — служебный read-only агент (стандартная библиотека Python, без сети), который превращает в машинную проверку ЖИЗНЕННЫЙ ЦИКЛ ПРЕДЛОЖЕНИЯ из docs/GOVERNANCE.md. Сам НЕ голосует, ничего не вносит и ничем не распоряжается (Конституция ст. 9). Проверяет два JSON-конфига управления — governance/snapshot/space.json и governance/safe/safe.config.json — на согласованность с конституцией: one-person-one-vote (стратегия голоса = ticket value=1, ни одной плутократической стратегии со взвешиванием по балансу — ст. 2/запрет №5), timed-vote (задержка и срок голосования заданы и положительны — GOVERNANCE §7), off-chain-signal (off_chain_signaling=true и все типы предложений binding=false: Snapshot обсуждает, исполняет Safe/Timelock после голосования — ст. 4/§5), proposal-binding (типы про деньги/конституцию привязаны к нормам: disbursement-direction→PRIORITIES+ANTI-ABUSE, constitution-amendment→CONSTITUTION + requires_supermajority — ст. 5/§7–§8/ст. 10), multisig-not-sole (порог Safe ≥2 и строго меньше числа владельцев — никто единолично, 3-из-5 — ст. 5/§5), lifecycle-links (все docs/- и governance/-ссылки конфигов резолвятся — ст. 3 проверяемость). Вывод человекочитаемый и --json; код возврата 0/1; «красный» = сигнал сообществу, не действие. Тест-инвариант ai-agents/test_governance.py (26/26) на временном мини-репо доказывает, что красное ловится на каждое отклонение (вес по балансу, ticket value≠1, плутократия в validation, нулевой срок, binding=true, распределение/поправка без привязки, threshold=1 или =числу владельцев, битая ссылка, отсутствие space.json), а зелёное не ложно-падает. CI .github/workflows/ai-agents.yml расширен (+ тест Governance + Governance). При первом прогоне на реальных конфигах: 6/6 зелёный. TESTNET-ONLY, без реальных средств/ключей.",
    "rationale": "Конституция ст. 9: ИИ служит, но не правит — агент read-only, находка = сигнал, а не действие, и он НИКОГДА не голосует. Governance замыкает на машинную проверку центральный риск управления: конфигурация Snapshot/Safe описана в docs/GOVERNANCE.md словами, но может молча разъехаться с конституцией (например, кто-то поменяет стратегию голоса на взвешивание по балансу = плутократия, или снизит порог мультисига до 1 = единоличная власть, или снимет супербольшинство с поправок к конституции). Агент доказывает прямо из конфигов, что: вес голоса = 1 на человека и не покупается (ст. 2, запрет №5); голосование ограничено сроком (§7); Snapshot не исполняет сам, а только сигналит (ст. 4, §5); распределение и поправки привязаны к PRIORITIES/ANTI-ABUSE/CONSTITUTION (ст. 5, §7–§8); средствами не распоряжается никто единолично (3-из-5, ст. 5, §5); жизненный цикл привязан к реальным докам (ст. 3). По образцу прошлых агентов: чтобы аудит не был «зелёным по умолчанию» — тест-инвариант на отравленных конфигах.",
    "deliverables": [
      "ai-agents/governance_agent.py: служебный read-only агент — 6 проверок жизненного цикла предложения над двумя конфигами управления (Snapshot space.json: one-person-one-vote/timed-vote/off-chain-signal/proposal-binding; Safe safe.config.json: multisig-not-sole; оба: lifecycle-links), вывод человекочитаемый и --json, код 0/1, опция --root для теста",
      "ai-agents/test_governance.py: тест-инвариант на временном мини-репо (26/26) — доказывает «красное ловится, зелёное не ложно-падает» (14 сценариев: корректные конфиги зелёные; плутократия по балансу; ticket value=5; плутократия спрятана в validation; period=0; off_chain_signaling=false; тип binding=true; распределение без ANTI-ABUSE; поправка без супербольшинства; нет типа constitution-amendment; threshold=1; threshold=владельцам; битая ссылка; нет space.json вовсе)",
      "ai-agents/README.md (+ EN README.en.md): Governance отмечен ✅ каркас, добавлен раздел «что делает и как запустить» + таблица 6 проверок + описание привязки типов и тест-инварианта; обновлена строка сводки CI",
      ".github/workflows/ai-agents.yml: CI расширен — + тест Governance + Governance на каждый push/PR (read-only)"
    ],
    "rails": [
      "агент read-only: ничего не двигает, ничем не владеет и НЕ голосует — только читает конфиги и докладывает; находка = сигнал, а не действие (ст. 9)",
      "только стандартная библиотека Python, без сети — детерминированно в CI; реальных средств/ключей/mainnet нет",
      "проверяет, что власть денег не покупается (вес голоса = 1), что Snapshot не исполняет сам и что мультисиг не даёт единоличного распоряжения средствами (укрепляет рельсы управления)",
      "приватность участников: публичен только факт/адрес, не личность",
      "пульс неприкосновенен: loop.sh/report.sh/.env/logs не тронуты",
      "двуязычность RU↔EN в одном коммите"
    ],
    "status": "adopted",
    "spec": "docs/GOVERNANCE.md",
    "roadmap_item": "Этап 6 — AI-агенты (каркас): модуль 7/8 — Governance-агент"
  },
  "prev_hash": "85b8950ae0f2bebfa220c34124bf09966932d7ea4aa9f49a1b2166f4538ea8d3",
  "hash": "43c27e02e3def694cf547cffe6d35459c89a30c92457c8c10db4943959b6aa1c"
}
