{
  "seq": 83,
  "id": "PTD-0083",
  "type": "decision",
  "timestamp": "2026-06-22T23:45:00Z",
  "actor": "builder-agent",
  "summary": "Восьмой экран платформы: «О платформе» (platform/app/about/) — единая страница-вход простым языком, что связывает семь экранов ценности в цельное приложение: что это за приложение, что важно знать сейчас (тестовый режим, черновики в браузере), с чего начать, честно и без слежки (рельсы прозрачности), частые вопросы (общественное благо, НЕ инвестиция); добавлена в меню шапки и подвал, RU<->EN; INBOX #34",
  "refs": [],
  "payload": {
    "decision": "Восьмой экран платформы (platform/): «О платформе» (platform/app/about/) — единая страница-объяснение простым языком, которая связывает семь экранов ценности в цельное приложение и встречает новичка. Состоит из пяти понятных блоков: (1) «Что это за приложение» — рабочее приложение Public Trust DAO: через него просят помощь, видят открытый журнал, голосуют наравне, проверяют казну и подтверждают, что за участником один настоящий живой человек; общественное благо, а не вложение. (2) «Что важно знать прямо сейчас» — честное предупреждение про тестовый режим: всё на тестовой сети без реальных денег, экраны собирают заявки/голоса/памятки проверяемыми черновиками в браузере, ничего не уходит наружу; настоящие действия включатся после деплоя контрактов в тестовой сети. (3) «С чего начать» — короткий путь новичка: посмотреть журнал/казну без проверки -> на «Проверке личности» увидеть нужный уровень -> подключить кошелёк -> подать заявку или проголосовать. (4) «Честно и без слежки» — рельсы прозрачности человеческими словами: нет трекеров/рекламы, системные шрифты, ничего со сторонних серверов, код открыт, версии зафиксированы, каждое решение в открытом журнале. (5) «Частые вопросы» — шесть ключевых: это вложение/заработок? пирамида/рефералы? кто распоряжается деньгами? нужны ли паспорт/лицо? сколько стоит? уже работает по-настоящему? Внизу — проверяемые ссылки на конституцию, открытый журнал и главный сайт. Страница добавлена в постоянное меню шапки (после «Главной») и ссылкой в подвале, RU<->EN.",
    "rationale": "Запланированная оператором серия из семи экранов ценности INBOX #34 закрыта (PTD-0075..PTD-0081), а единственный оставшийся подпункт #34 — публикация платформы на GitHub Pages — требует решения оператора (переключение Pages с витрины web/ на сборку platform/) и не делается агентом. Чтобы не блокироваться и довести «полноценное приложение» (требование оператора «функционал не урезать»), добавлен недостающий для настоящего приложения элемент — страница-вход «О платформе»: она простым языком объясняет новичку, что это, что важно знать в тестовом режиме, с чего начать и почему всё честно и без слежки, плюс отвечает на частые вопросы «общественное благо, НЕ инвестиция». Контент сведён из уже принятых материалов (дисклеймер, docs/PROMOTION.md FAQ, рельсы прозрачности) — не вводит новых обещаний. Это повышает понятность (конституция ст. 3/6) и связность приложения, оставаясь строго в рельсах.",
    "deliverables": [
      "platform/app/about/page.tsx — страница «О платформе»: ведущий hero с дисклеймером, блоки «Что это»/«Что важно знать сейчас»/«С чего начать»/«Честно и без слежки»/«Частые вопросы» и проверяемые внешние ссылки; переиспользует существующие классы (hero--screen, panel, explain, plain-list, wallet-note--warn, screen-card-link), доступность через aria-labelledby/role=note.",
      "platform/lib/i18n.ts — новый двуязычный (RU<->EN) словарь страницы (тип AboutDict) простым языком (правило PTD-0040): лид, три списка-блока, шесть пар вопрос/ответ, подписи ссылок; добавлена метка навигации navAbout (RU «О платформе» / EN «About») в обоих языках.",
      "platform/components/SiteHeader.tsx — пункт «О платформе» добавлен в постоянное меню сразу после «Главной» (перед экранами ценности).",
      "platform/components/SiteFooter.tsx — ссылка «О платформе» добавлена в подвал.",
      "platform/app/globals.css — добавлен стиль .faq-list/.faq-item (список вопросов-ответов) в духе существующего .split-list."
    ],
    "rails": [
      "Прозрачность и цепочка поставок: ноль исходящих запросов — страница статична, без сторонних библиотек/трекеров/CDN/внешних шрифтов; внешние ссылки ведут только на открытый репозиторий и главный сайт проекта",
      "Без новых обещаний: тексты FAQ повторяют конституционные запреты (не инвестиция, не пирамида, без платы за привлечение, никто не распоряжается единолично) — сверены с PRINCIPLES.md/PROMOTION.md",
      "TESTNET-first: страница прямо сообщает про тестовый режим и черновики в браузере; реальных денег и данных нет",
      "Понятный язык RU<->EN в одном коммите (PTD-0040)",
      "Локальная сборка не выполнялась намеренно: диск хоста 100% (npm рискует добить диск) — типы и сборку (.tsx с JSX) проверяет .github/workflows/platform.yml на серверах GitHub",
      "Пульс (loop.sh/report.sh/сервис/.env/logs) не тронут"
    ],
    "status": "adopted",
    "spec": "platform/app/about/page.tsx",
    "verification": "registry verify зелёный. ВНИМАНИЕ: next build/typecheck локально не прогнаны (диск хоста 100%, node_modules не ставится) — типы и сборку (включая .tsx с JSX) проверяет .github/workflows/platform.yml на серверах GitHub.",
    "advances_roadmap": [
      "Платформа фонда на Next.js — страница «О платформе» связывает экраны ценности в цельное приложение (INBOX #34)"
    ]
  },
  "prev_hash": "6cb897336a3073853d9744aa87add874875939fb68fa0c7f376fbd0e7989121d",
  "hash": "df55c787c5d113fcd0864ba8d52b5f2a796749c565ab395d5dcbebfd7ebcf503"
}
