{
  "seq": 45,
  "id": "PTD-0045",
  "type": "decision",
  "timestamp": "2026-06-22T11:00:00Z",
  "actor": "builder-agent",
  "summary": "INBOX #19 — продолжение прохода «понятный язык»: docs/PROOF-OF-CONTRIBUTION.md (+EN) переписан по образцу REWARDS-MODEL/GOVERNANCE/ANTI-ABUSE/ESCROW — ведущий раздел «Главное простыми словами» («фонд создаёт честную работу вокруг помощи; за работу платят, но не на слово»), жаргон (bounty/milestone, escrow, проблема оракула, soulbound, анти-Сивилла, skin in the game, state machine, Solidity-эскиз) вынесен в «Технический раздел — для разработчиков». Смысл не изменён. INBOX #19 остаётся открытым.",
  "refs": [
    "docs/PROOF-OF-CONTRIBUTION.md",
    "docs/en/PROOF-OF-CONTRIBUTION.md",
    "comms/INBOX.md"
  ],
  "payload": {
    "decision": "INBOX #19 (понятный язык везде) — продолжение прохода: docs/PROOF-OF-CONTRIBUTION.md (+ EN docs/en/PROOF-OF-CONTRIBUTION.md) переписан по образцу REWARDS-MODEL/GOVERNANCE/ANTI-ABUSE/ESCROW. Человеческий заголовок «Как фонд создаёт оплачиваемую работу — и честно проверяет, что она сделана», ведущий раздел «Главное — простыми словами» (главная мысль «фонд создаёт честную работу вокруг помощи; за работу платят, но не на слово» + 6 пунктов + честное признание о слабом месте обычными словами). Жаргон вынесен в «Технический раздел — для разработчиков»: bounty/milestone, escrow, release condition, анти-Сивилла, soulbound-бейдж, skin in the game, dispute window, circuit breaker, проблема оракула, state machine, Solidity-эскиз IContributionEscrow. Смысл механики доказательства вклада не изменён. INBOX #19 остаётся открытым (следующий кандидат: PRIORITIES).",
    "rationale": "Открытый пункт оператора INBOX #19 — высший приоритет. PROOF-OF-CONTRIBUTION.md был нормативным документом с объяснением «простыми словами» в самом конце (§10) и обильным жаргоном в основном тексте (проблема оракула, soulbound-бейдж, анти-Сивилла, skin in the game, state machine, release condition, bounty/milestone, circuit breaker), что противоречит конституции (ст. 3 «понятность», ст. 6 «объяснимость»). Переписан по уже зарегистрированному сквозному правилу PTD-0040 и образцу REWARDS-MODEL (PTD-0038)/GOVERNANCE (PTD-0042)/ANTI-ABUSE (PTD-0043)/ESCROW (PTD-0044): сначала простыми словами, техника ниже. Содержательная модель (работа рождается из помощи; деньги заморожены под задачу; три опоры доказательства; коллективная проверка + ставка репутации; ИИ считает но не решает; срок на споры; условие выплаты из трёх условий; анти-фрод; честность о проблеме оракула) сохранена без изменений.",
    "deliverables": [
      "docs/PROOF-OF-CONTRIBUTION.md — переписан по-человечески: ведущий раздел «Главное — простыми словами», разделы (что считается работой, три опоры доказательства, кто проверяет, когда деньги разблокируются, защита от обмана, честно о слабом месте, что открыто/что приватно, как объяснять людям) обычными словами; вся техника (терминология, state machine, условие выплаты, Solidity-эскиз IContributionEscrow) в «Техническом разделе — для разработчиков»",
      "docs/en/PROOF-OF-CONTRIBUTION.md — EN-зеркало по той же структуре (plain words first, Technical section for developers)",
      "governance/ipfs/manifest.json — пересобран (документ изменён), verify=OK",
      "governance/registry/ — запись PTD-0045 (type=decision)"
    ],
    "rails": [
      "Понятность как конституционное требование (ст. 3/6): человеку — простой язык, разработчику — техраздел; смысл механики доказательства вклада не изменён",
      "Жаргон убран из основного текста: bounty → разовая задача; milestone → этапная работа; escrow → деньги заморожены под задачу; release condition → условие выплаты; анти-Сивилла → защита от накруток и фейковых аккаунтов; soulbound-бейдж → личный непередаваемый знак участника; skin in the game → проверяющий ставит репутацию; dispute window → срок на споры; circuit breaker → стоп-кран; проблема оракула пояснена словами; state machine → путь задачи по шагам",
      "Содержательные рельсы не тронуты: деньги замораживаются под задачу при назначении; доказательство тремя опорами (подтверждение получателя + следы работы + автопроверка); ≥2 независимых проверяющих; исполнитель ≠ проверяющий ≠ получатель; проверяющий ставит репутацию; ИИ считает и сигналит, но не решает (ст. 9); выплата только при подтверждение∧≥N проверяющих∧истёкший срок споров; нужда приоритетнее награды; TESTNET-first, реальные средства только после аудита",
      "Двуязычность RU↔EN в одном коммите",
      "INBOX #19 остаётся открытым: проход продолжается, следующий кандидат — PRIORITIES"
    ],
    "status": "adopted",
    "spec": "docs/PROOF-OF-CONTRIBUTION.md",
    "advances_inbox": 19
  },
  "prev_hash": "37906ade14c45abe3981d36d18e2ad88c16632e285fa6fcd428292087df1d190",
  "hash": "f0ec7d1eb20f48d73cabc9ff4a9a93efc2c67503a1a8ce70dee8c79a1521877a"
}
