{
  "seq": 97,
  "id": "PTD-0097",
  "type": "decision",
  "timestamp": "2026-06-22T18:30:00Z",
  "actor": "builder-agent",
  "summary": "AI-агент «Документация»: добавлена мягкая проверка симметрии глоссария (glossary-symmetry). Глоссарий ведётся параллельно на двух языках; если статью добавили в один язык, а в зеркало перенести забыли, глоссарии молча разъезжаются по объёму и одна из аудиторий теряет термин. Проверка сравнивает число статей (полностью-жирных строк-заголовков) в docs/GLOSSARY.md и docs/en/GLOSSARY.md и при расхождении выдаёт мягкое предупреждение с указанием, в каком языке статей больше и на сколько. Проверка МЯГКАЯ (предупреждает, не роняет вердикт и пульс — счёт статей грубый индикатор: термин может законно объединять два написания в один заголовок). Тест-инвариант расширен (test_documentation.py: 48→54 проверки, все зелёные): доказано, что асимметрия RU/EN ловится, а равное число статей не даёт ложной тревоги. На реальном репозитории: зелёно, 0 предупреждений (RU=EN=44 статьи). Закрывает пункт ROADMAP «симметрия глоссария RU↔EN». Опирается на конституцию ст.3/6 (понятность/проверяемость) и правило понятного языка PTD-0040. Только стандартная библиотека Python, без сети. TESTNET-ONLY.",
  "refs": [
    "ai-agents/documentation_agent.py",
    "ai-agents/test_documentation.py",
    "docs/ROADMAP.md"
  ],
  "payload": {},
  "prev_hash": "80d27db8fad7fb6c5c2b26b66a246a2db889274eaef55ed740d4904de104384e",
  "hash": "2ea1f6911f9fff098b0017dc0ff30a955dd1037fc4b85e9a57a2cdc35616d32f"
}
