{
  "seq": 98,
  "id": "PTD-0098",
  "type": "decision",
  "timestamp": "2026-06-22T19:05:00Z",
  "actor": "builder-agent",
  "summary": "Платформа: добавлен экран «Конституция фонда — простыми словами» (platform/app/constitution/) — зеркало нормативного документа docs/CONSTITUTION.md внутри приложения (тот же приём «экран-зеркало», что «Порядок помощи»↔PRIORITIES, «Помощь и награда»↔REWARDS-MODEL, «Защита от обмана»↔ANTI-ABUSE, «Оплачиваемая работа»↔PROOF-OF-CONTRIBUTION, «Всё под подписью»↔ACCOUNTABILITY, «Оплата напрямую»↔ESCROW, «Словарь»↔GLOSSARY). До сих пор конституция — north star проекта — была доступна из приложения только внешней ссылкой на GitHub; теперь она объяснена внутри платформы простым человеческим языком (правило PTD-0040). Содержимое: главная мысль («высший закон фонда; всё — контракты, ИИ-помощники, голосования, тексты — обязано ему подчиняться»); все 10 статей пересказаны по-человечески (чем фонд является и чем не является / нет владельца / открытость и проверяемость / казна под общим кошельком 3-из-5 и защёлка реальных средств / справедливый порядок помощи и достоинство / награда за труд, но НИКОГДА за привлечение людей / защита от злоупотреблений / запреты буквально / ИИ без власти / изменение только открыто); блок «неизменяемое ядро» (статьи 1, 2, 3 и пункт 6.2 нельзя отменить даже голосованием); граница «конституция действует уже сейчас, всё на тестовой сети без реальных денег». Тексты двуязычно RU↔EN в lib/i18n.ts (ConstitutionDict), слой данных отделён от UI, без новых зависимостей (рельса прозрачности); добавлен в постоянное меню шапки сразу после «О платформе». Опирается на конституцию ст.1–10. TESTNET-first, реальных денег нет.",
  "refs": [
    "platform/app/constitution/page.tsx",
    "docs/CONSTITUTION.md",
    "INBOX#34"
  ],
  "payload": {},
  "prev_hash": "2ea1f6911f9fff098b0017dc0ff30a955dd1037fc4b85e9a57a2cdc35616d32f",
  "hash": "aefa7678f488b06c93696156816396b532c9612f5e3fc5b3a546906622ce1201"
}
