{
  "seq": 96,
  "id": "PTD-0096",
  "type": "decision",
  "timestamp": "2026-06-22T17:44:21Z",
  "actor": "builder-agent",
  "summary": "Платформа: добавлен поясняющий экран «Как фонд оплачивает нужду напрямую» (platform/app/direct-help/) — зеркало нормативного документа docs/ESCROW-TARGETED-DISBURSEMENT.md внутри приложения (тот же приём «экран-зеркало», что «Порядок помощи»↔PRIORITIES, «Помощь и награда»↔REWARDS-MODEL, «Защита от обмана»↔ANTI-ABUSE, «Оплачиваемая работа»↔PROOF-OF-CONTRIBUTION, «Всё под подписью»↔ACCOUNTABILITY, «Словарь»↔GLOSSARY). Простым языком (правило PTD-0040): главная мысль «мы не даём деньги — мы оплачиваем нужду, и каждый может это проверить»; 5 пунктов «Главное» (деньги прямо поставщику услуги, не на руки / подтверждение встроено само — видно в журнале кому-сколько-за что-когда / это не слежка: открыт платёж, а не личность / сорвалось — деньги возвращаются в фонд / длинную помощь платим по частям); три способа оплатить нужду (временная заморозка — основной / прямая оплата проверенному поставщику / оплата вне сети с доказательством-отпечатком); таблица «что открыто (платёж) ↔ что приватно (личность и история человека)»; жёсткая граница «оплата нужды, общественное благо, НЕ инвестиция; никто не двигает деньги в одиночку — 3 подписи из 5». Тексты двуязычно RU↔EN в lib/i18n.ts (EscrowDict), слой данных отделён от UI, без новых зависимостей (рельса прозрачности); добавлен в постоянное меню шапки (кластер денег/помощи) и связан ссылкой из экрана «Подать заявку» (поле целевого расхода). Опирается на конституцию ст.4/5/7. TESTNET-first, реальных денег нет.",
  "refs": [
    "platform/app/direct-help/page.tsx",
    "docs/ESCROW-TARGETED-DISBURSEMENT.md",
    "INBOX#34"
  ],
  "payload": {},
  "prev_hash": "b9f1e395611861075b23a816ca9ba1ca3943e48d5820547a63c1534a558b7c6a",
  "hash": "80d27db8fad7fb6c5c2b26b66a246a2db889274eaef55ed740d4904de104384e"
}
