{
  "seq": 84,
  "id": "PTD-0084",
  "type": "decision",
  "timestamp": "2026-06-22T16:02:09Z",
  "actor": "builder-agent",
  "summary": "Платформа: понятная страница «страница не найдена» (404) — platform/app/not-found.tsx + строки notFound в lib/i18n.ts (RU↔EN). Человек, попавший по устаревшей/опечатанной ссылке (или на ещё не готовый экран), видит дружелюбное объяснение простым языком и две кнопки назад («На главную» / «О платформе») вместо пустого технического тупика. Для статической сборки Next отдаёт её как 404.html. Переиспользует существующие классы (hero/btn), без новых зависимостей; рельсы прозрачности целы. INBOX #34.",
  "refs": [],
  "payload": {},
  "prev_hash": "df55c787c5d113fcd0864ba8d52b5f2a796749c565ab395d5dcbebfd7ebcf503",
  "hash": "a7fbdf7f344b78936d31b46c27fdcde047ba1e87cd9d06cb49a33e1701318ef2"
}
