{
  "seq": 26,
  "id": "PTD-0026",
  "type": "decision",
  "timestamp": "2026-06-22T11:00:00Z",
  "actor": "builder-agent",
  "summary": "Этап 6 (AI-агенты), модуль 6/8: Documentation-агент. documentation_agent.py — read-only проверка двуязычности RU↔EN (пара + переключатель языка у каждого публичного дока) и целостности относительных ссылок во всех .md, по правилу пар из пути. Тест-инвариант test_documentation.py (17/17). При первом прогоне вскрыл и закрыл пробел: добавлены EN-зеркала governance/ipfs/README.md и governance/registry/README.md. Закрывает P2 «авто-проверка двуязычности в CI». CI расширен. TESTNET-ONLY.",
  "refs": [
    "ai-agents/documentation_agent.py",
    "ai-agents/test_documentation.py",
    "governance/ipfs/README.en.md",
    "governance/registry/README.en.md",
    ".github/workflows/ai-agents.yml"
  ],
  "payload": {
    "decision": "Этап 6 (AI-агенты), модуль 6/8: Documentation-агент. ai-agents/documentation_agent.py — служебный read-only агент (стандартная библиотека Python, без сети, по git-отслеживаемым .md), превращает в машинную проверку указание оператора «вся документация двуязычна (RU↔EN)» и конституционную проверяемость/открытость. Три проверки: bilingual-pairs (у каждого публичного дока есть пара RU↔EN по правилу пар, выводимому из пути: docs/NAME.md↔docs/en/NAME.md; <dir>/README.md↔<dir>/README.en.md; корневой NAME.md↔NAME.en.md), language-switcher (вверху дока корректный переключатель [Русский]·[English], ведущий к парному файлу), link-integrity (все относительные ссылки в .md ведут к существующему файлу/каталогу; внешние ссылки и блоки кода исключены — без ложных срабатываний). Служебные одноязычные файлы (BUILDER/LAUNCH/PROGRESS/DECISIONS/comms) исключены by design. Вывод человекочитаемый и --json; код 0/1; «красный» = сигнал сообществу, не действие. Тест-инвариант ai-agents/test_documentation.py (17/17) на временном мини-репо доказывает «красное ловится, зелёное не ложно-падает». CI .github/workflows/ai-agents.yml расширен (+ тест Documentation + Documentation; триггеры расширены на **/*.md и *.md). При первом прогоне агент поймал реальный пробел: у governance/ipfs/README.md и governance/registry/README.md не было EN-зеркал — добавлены EN-зеркала + переключатели языка (теперь документация двуязычна на 8/8 проверок). Закрывает и пункт P2 ROADMAP «авто-проверка двуязычности в CI». TESTNET-ONLY, без реальных средств/ключей.",
    "rationale": "Конституция ст. 9: ИИ служит, но не правит — агент read-only, находка = сигнал, а не действие (агент не дописывает переводы и не правит ссылки сам). Documentation замыкает на машинную проверку давнее организационное правило проекта (двуязычность RU↔EN в одном коммите) и линк-чек, которые до сих пор делались вручную каждую сессию и потому могли тихо разъехаться. Правило пар выводится из пути, а не зашивается пофайлово, поэтому проверка автоматически охватывает будущие документы без правки агента. По образцу предыдущих агентов аудит доказан тест-инвариантом на отравленных версиях мини-репо, чтобы не быть «зелёным по умолчанию». Польза проявилась сразу — агент вскрыл и заставил закрыть реальный пробел двуязычности (два технических README без EN-зеркал), что само по себе продвигает конституционную открытость (ст. 6). Привязывает CONSTITUTION ст. 3 (проверяемость) и ст. 6 (открытость/понятность) к коду.",
    "deliverables": [
      "ai-agents/documentation_agent.py: служебный read-only агент — 3 проверки (bilingual-pairs/language-switcher/link-integrity) по git-отслеживаемым .md; правило пар RU↔EN выводится из пути; исключение служебных одноязычных файлов (SINGLE_LANG); вырезание блоков кода и внешних ссылок при линк-чеке; вывод человекочитаемый и --json; код 0/1; опция --root для теста; фолбэк на обход дерева без git",
      "ai-agents/test_documentation.py: тест-инвариант на временном мини-репо (17/17) — доказывает «красное ловится, зелёное не ложно-падает» (нет EN-зеркала, нет RU-оригинала, нет/перепутанный переключатель, переключатель на чужой файл, битая относительная ссылка; корректный двуязычный репо — зелёный; служебный одноязычный файл, внешние ссылки и код-блоки не ронят; обычный одноязычный файл без пары — ловится)",
      "governance/ipfs/README.en.md + governance/registry/README.en.md: НОВЫЕ EN-зеркала двух технических README (вскрыты агентом как отсутствующие) + переключатель языка [Русский]·[English] добавлен в RU-оригиналы — двуязычная коверка governance-подкаталогов закрыта",
      "ai-agents/README.md (+ EN README.en.md): Documentation отмечен ✅ каркас, добавлен раздел «что делает и как запустить» + таблица проверок + правило пар + описание тест-инварианта",
      ".github/workflows/ai-agents.yml: CI расширен — + тест Documentation + Documentation на каждый push/PR (read-only); триггеры путей расширены на **/*.md и *.md, чтобы агент двуязычности срабатывал на любые изменения документации"
    ],
    "rails": [
      "агент read-only: ничего не двигает и ничем не владеет, только читает .md и докладывает; находка = сигнал, а не действие (ст. 9); агент НЕ дописывает переводы и НЕ правит ссылки — это делают люди",
      "только стандартная библиотека Python, без сети — детерминированно в CI; реальных средств/ключей/mainnet нет",
      "укрепляет конституционную открытость (ст. 6) и проверяемость (ст. 3): документация не разъедется молча между RU и EN, ссылки не сгниют незаметно",
      "пульс неприкосновенен: loop.sh/report.sh/.env/logs не тронуты",
      "двуязычность RU↔EN в одном коммите (агент сам это правило и обеспечивает)"
    ],
    "status": "adopted",
    "spec": "BUILDER.md (правило двуязычности RU↔EN)",
    "roadmap_item": "Этап 6 — AI-агенты (каркас): модуль 6/8 — Documentation-агент (закрывает P2 «авто-проверка двуязычности в CI»)"
  },
  "prev_hash": "73c321dfe7e292f118411a9d939c901fdf9b72869a8e45722dc665aae8a6f33f",
  "hash": "85b8950ae0f2bebfa220c34124bf09966932d7ea4aa9f49a1b2166f4538ea8d3"
}
