{
  "seq": 91,
  "id": "PTD-0091",
  "type": "decision",
  "timestamp": "2026-06-22T17:03:14Z",
  "actor": "builder-agent",
  "summary": "Платформа: добавлен поясняющий экран «Как фонд защищён от обмана и воровства» (platform/app/safeguards/) — зеркало нормативного документа docs/ANTI-ABUSE.md внутри приложения (тот же приём, что «Порядок помощи»↔PRIORITIES, «Помощь и награда»↔REWARDS-MODEL, «Словарь»↔GLOSSARY). Простым языком (правило PTD-0040): главная мысль «быть честным выгоднее, чем обманывать»; 7 пунктов «Главное — простыми словами» (выплата по частям, лимит на крупные суммы, подтверждение несколькими независимыми людьми, открытый журнал, стоп-кран без вывода себе, заслуги не дают власти над деньгами, право оспорить); 9 опор защиты кошелька; про репутацию (только подспорье, нельзя купить, не зависит от «приведи друга», не даёт власти над деньгами); коротко «красть невыгодно, обманом много не выманить, захватить кошелёк нельзя». Тексты двуязычно RU↔EN в lib/i18n.ts (SafeguardsDict), слой данных отделён от UI, без новых зависимостей (рельса прозрачности: ничего не подгружается со стороны); добавлен в постоянное меню шапки. Опирается на конституцию ст.7. TESTNET-first, реальных денег нет.",
  "refs": [
    "platform/app/safeguards/page.tsx",
    "docs/ANTI-ABUSE.md",
    "INBOX#34"
  ],
  "payload": {},
  "prev_hash": "44b2eebaef4c7f790b609315207da69b365fd00fb84e689b440f13078e111239",
  "hash": "6cd18932b80a7924c8fd2bfd914be9af805a8025fe783d3c5a61c952dc0e1128"
}
