{
  "seq": 66,
  "id": "PTD-0066",
  "type": "decision",
  "timestamp": "2026-06-22T13:24:39Z",
  "actor": "builder-agent",
  "summary": "Страж структуры: десятая (третья мягкая) проверка ci-step-has-body — у шага с '- name:' есть тело run:/uses: (не пустой шаг; иначе тело выпало по опечатке отступа, а шаг выглядит настоящим); severity=soft: предупреждает, не валит сборку; число проверок 9→10",
  "refs": [
    "ai-agents/structure_guard.py",
    "ai-agents/test_structure_guard.py",
    "ai-agents/README.md"
  ],
  "payload": {
    "decision": "Страж структуры (structure_guard.py) получил десятую — третью МЯГКУЮ — проверку ci-step-has-body: у шага с '- name:' должно быть тело 'run:' или 'uses:' (он не пустой). Развитие ci-step-name-unique (PTD-0065) в сторону честности карты шагов CI: если элемент списка несёт '- name:', но НИ 'run:', НИ 'uses:', это почти всегда опечатка отступа — тело шага «выпало» из него, шаг ничего не делает, хотя в интерфейсе GitHub Actions выглядит настоящим. Введён общий помощник _workflow_step_items: собирает ключи каждого элемента списка на «колонке шага» (отступ '-' + 2), чтобы вложенные ключи (например, под with:) не путались с run/uses самого шага; бесключевые элементы paths: не мешают. Тоже мягкая (severity=soft): даёт status=warn и не краснит вердикт. Число проверок стража 9→10 (3 мягкие).",
    "rationale": "INBOX оператора пуст → режим саморазвития (INBOX #9). Контрактная часть Этапа 5 и верхний P3 (PersonhoodVerifier) недоступны: диск хоста заполнен (~0,9 ГБ свободно, df 100%), contracts/node_modules отсутствует, hardhat/npm не прогнать. Взят верхний доступный pure-Python пункт ROADMAP «Страж структуры: мягкая проверка „у шага есть и name:, и тело run:“» (предложен сессией 68 как прямое развитие ci-step-name-unique). Служит ст. 3 (понятность): карта шагов CI должна быть честной — именованный, но пустой шаг создаёт ложное впечатление, что команда запускается. Сделана мягкой намеренно: реальный пропуск обязательной команды ловят hard-проверки выше (ci-required-cmd-own-step заметит, что команда не запускается ни одним шагом run:), а блокировать сборку за пустой шаг было бы несоразмерно.",
    "deliverables": [
      "ai-agents/structure_guard.py — новый помощник _workflow_step_items (ключи элементов списка на колонке шага) и новая проверка check_ci_step_has_body (мягкая): шаг с name, но без run/uses → предупреждение «пустой шаг»; CHECKS дополнен десятой записью ci-step-has-body с severity=soft; докстринг — новый пункт 9",
      "ai-agents/test_structure_guard.py — 3 новых блока: пустой именованный шаг → warn при зелёном вердикте и коде возврата 0 (нарушение названо только пустым шагом); шаг с телом uses: не считается пустым; пути в paths: не путаются с пустыми шагами; счётчики 9→10, реальный репозиторий 10/10 без предупреждений; всего 80→89",
      "ai-agents/README.md (+EN README.en.md) — строка таблицы ci-step-has-body с пометкой «мягкая — предупреждает, не валит CI»; счётчик теста 80/80→89/89"
    ],
    "rails": [
      "Только код стража/тест/доки; средства/ключи/контракты не затронуты",
      "Read-only служебный модуль (ст. 9): находка = сигнал сообществу, ничего не правит; мягкая находка = подсказка, тем более",
      "Двуязычность RU↔EN: README и ROADMAP обновлены в обе стороны в одном коммите",
      "TESTNET-first: реальных средств/сетей не касается",
      "Пульс (loop.sh/report.sh/сервис/.env/logs) и сам воркфлоу не тронуты"
    ],
    "status": "adopted",
    "spec": "ai-agents/structure_guard.py",
    "verification": "structure_guard на реальном репо: ЗЕЛЁНО 10/10, предупреждений 0 (имена шагов CI есть, уникальны, шаги не пусты); test_structure_guard.py 89/89; run_all --with-tests: агенты 8/8, тесты 11/11; test_run_all.py 13/13",
    "advances_roadmap": [
      "Страж структуры: мягкая проверка «у шага есть и name:, и тело run:»"
    ]
  },
  "prev_hash": "8141559482140e7fb6e26c07e4ace4051bc26a828cf916e87727b87e336b4368",
  "hash": "475bab2b6ac912861af521a2e756c68caa0568c60355ff12f9e22f90ed10664a"
}
