{
  "seq": 42,
  "id": "PTD-0042",
  "type": "decision",
  "timestamp": "2026-06-22T10:15:00Z",
  "actor": "builder-agent",
  "summary": "INBOX #19 — продолжение прохода «понятный язык»: docs/GOVERNANCE.md (+EN) переписан по образцу REWARDS-MODEL — ведущий раздел «Главное простыми словами», жаргон (атака Сивиллы, soulbound, плутократия, web-of-trust, Governor→Timelock) вынесен в «Технический раздел — для разработчиков». Смысл управления не изменён. INBOX #19 остаётся открытым.",
  "refs": [
    "docs/GOVERNANCE.md",
    "docs/en/GOVERNANCE.md",
    "comms/INBOX.md"
  ],
  "payload": {
    "decision": "INBOX #19 (понятный язык везде) — продолжение прохода: docs/GOVERNANCE.md (+ EN docs/en/GOVERNANCE.md) переписан по образцу REWARDS-MODEL. Человеческий заголовок «Как фонд принимает решения: голос каждого человека», ведущий раздел «Главное — простыми словами» (6 пунктов: один человек — один голос; любой может предложить, сообщество голосует; прошедшее решение казна исполняет с задержкой на проверку; деньгами не распоряжается ни один человек — хранители 3-из-5 это исполнитель и аварийный тормоз, не власть; проверка уникальности даёт голос, а не власть над деньгами; фонд постепенно становится самостоятельнее). Жаргон вынесен из основного текста: «атака Сивиллы» → «защита от накруток и фейковых аккаунтов»; «soulbound-бейдж» → «личный непередаваемый знак участника»; «плутократия» → «власть денег»; «web-of-trust» → «поручительство участников друг за друга»; «proof-of-personhood» пояснён простыми словами. Архитектура Governor/Timelock/Treasury/Snapshot, диаграмма, soulbound, кворум, фазы A–D и формальные поправки к конституции П-1…П-3 перенесены в «Технический раздел — для разработчиков». Смысл управления не изменён — изменена подача. INBOX #19 остаётся открытым (следующие кандидаты: PROOF-OF-CONTRIBUTION, ANTI-ABUSE, ESCROW-TARGETED-DISBURSEMENT, PRIORITIES).",
    "rationale": "Открытый пункт оператора INBOX #19 — высший приоритет. GOVERNANCE.md был самым формульным/жаргонным после REWARDS-MODEL (атака Сивиллы, soulbound, плутократия, web-of-trust, Governor→Timelock в основном тексте), что противоречит конституции (ст. 3 «понятность», ст. 6 «объяснимость»). Переписан по уже зарегистрированному сквозному правилу PTD-0040 и по образцу REWARDS-MODEL (PTD-0038): сначала простыми словами, техника ниже. Все содержательные рельсы (1 человек=1 голос, голос не покупается/не продаётся, уникальность ≠ власть, мультисиг как исполнитель/аварийка, защёлка ст. 4.4, TESTNET-first) сохранены без изменений. Поправки к конституции П-1…П-3 остаются предложением (ст. 10), ядро не тронуто.",
    "deliverables": [
      "docs/GOVERNANCE.md — переписан по-человечески: ведущий раздел «Главное — простыми словами», обычные слова в основном тексте, архитектура/диаграмма/Governor-Timelock/поправки П-1…П-3 в «Техническом разделе — для разработчиков»",
      "docs/en/GOVERNANCE.md — EN-зеркало по той же структуре (plain words first, Technical section for developers)",
      "governance/ipfs/manifest.json — пересобран (docs/GOVERNANCE.md изменён), verify=OK, 18 записей",
      "governance/registry/ — запись PTD-0042 (type=decision)"
    ],
    "rails": [
      "Понятность как конституционное требование (ст. 3/6): человеку — простой язык, разработчику — техраздел; смысл модели управления не изменён",
      "Жаргон убран из основного текста: атака Сивиллы → защита от накруток и фейковых аккаунтов; soulbound-бейдж → личный непередаваемый знак участника; плутократия → власть денег; web-of-trust → поручительство участников друг за друга; proof-of-personhood пояснён словами",
      "Содержательные рельсы управления не тронуты: 1 человек = 1 голос, голос не покупается/не продаётся, уникальность ≠ власть, мультисиг 3-из-5 — исполнитель/аварийная пауза а не правитель, защёлка реальных средств ст. 4.4, TESTNET-first",
      "Поправки к конституции П-1…П-3 остаются предложением до ратификации по ст. 10; неизменяемое ядро (ст. 1,2,3, п. 6.2) не тронуто",
      "Двуязычность RU↔EN в одном коммите",
      "INBOX #19 остаётся открытым: проход продолжается, следующие кандидаты — PROOF-OF-CONTRIBUTION, ANTI-ABUSE, ESCROW-TARGETED-DISBURSEMENT, PRIORITIES"
    ],
    "status": "adopted",
    "spec": "docs/GOVERNANCE.md",
    "advances_inbox": 19
  },
  "prev_hash": "28e293c4229e759e1f1daee86d99ec6baf90037064a96e940cb54ba3c8e6c840",
  "hash": "48498de3a798752c109dbe92ced50a56279ec56836076b19f68a3d0e72737667"
}
