{
  "seq": 8,
  "id": "PTD-0008",
  "type": "decision",
  "timestamp": "2026-06-22T05:08:00Z",
  "actor": "builder-agent",
  "summary": "Доработан публичный сайт (INBOX #14, ui-ux-pro-max): новый дизайн web/index.html (Accessible & Ethical, светлая+тёмная тема, доступность, анимация за reduced-motion) + EN-зеркало web/index.en.html; ноль исходящих запросов, дисклеймер «НЕ инвестиция» сохранён",
  "refs": [
    "web/index.html",
    "web/index.en.html",
    "web/assets/style.css"
  ],
  "payload": {
    "decision": "Доработан публичный сайт (INBOX #14, через скилл ui-ux-pro-max): web/index.html переписан в стиле «Accessible & Ethical» — высокий контраст, семантические токены тем, сдержанная анимация. Добавлены: полноценная светлая И тёмная тема (prefers-color-scheme + ручной переключатель, выбор хранится только в localStorage пользователя), переключатель языка RU/EN в шапке, ссылка «к содержимому» (skip-link), видимые focus-кольца, корректная иерархия заголовков, SVG-иконки вместо эмодзи, мягкое появление секций через IntersectionObserver — всё за prefers-reduced-motion. Создано EN-зеркало web/index.en.html (полный перевод, та же структура). Сохранены суть и рельсы: дисклеймер «НЕ инвестиция/НЕ пирамида» на видном месте, прозрачность и ссылки на реестр/доки, ни одного исходящего запроса (нет внешних шрифтов/CDN/трекеров/фреймворков).",
    "rationale": "Запрос оператора (INBOX #14): прокачать сайт по современным UI/UX-стандартам, сохранив суть и дисклеймер. Стиль выбран по рекомендации скилла ui-ux-pro-max для общественно-полезного/гражданского продукта (Accessible & Ethical, WCAG-ориентир); фирменная палитра оставлена trust-blue + verification-green (анти-паттерн скилла прямо предостерегает от «AI-фиолетовых градиентов»). Жёсткое требование прозрачности — ноль исходящих запросов — исключает Google Fonts/CDN, поэтому вместо подключаемого шрифта использован системный стек с улучшенной типошкалой. Двуязычность RU↔EN выполнена в том же коммите (правило BUILDER.md).",
    "deliverables": [
      "web/index.html — переписан (Accessible & Ethical, светлая+тёмная тема, переключатели темы/языка, доступность, анимация за reduced-motion)",
      "web/index.en.html — новое EN-зеркало (полный перевод, та же структура)",
      "web/assets/style.css — семантические токены тем (dark по умолчанию + light), focus-кольца, hover/reveal-переходы, адаптив 640px",
      "переключатель темы (инлайн-JS без фреймворков, выбор только в localStorage)",
      "переключатель языка RU/EN в шапке + hreflang-связки",
      "skip-link, aria-label на иконочных кнопках, scope на заголовках таблицы, tabular-nums в данных"
    ],
    "rails": [
      "ноль исходящих запросов: нет внешних шрифтов/CDN/трекеров/фреймворков",
      "дисклеймер «НЕ инвестиция, НЕ пирамида, НЕ извлечение прибыли» на видном месте (hero + футер)",
      "тексты сверены с PRINCIPLES.md: без обещаний доходности/прибыли, без рефералов",
      "выбор темы хранится только в браузере посетителя, наружу не отправляется",
      "prefers-reduced-motion полностью отключает анимацию",
      "двуязычность RU↔EN в одном коммите"
    ],
    "status": "adopted",
    "spec": "docs/PROMOTION.md",
    "closes_inbox": [
      "14-site-redesign"
    ]
  },
  "prev_hash": "819528e1f460a2fab5f2ce058edb6051030875257bfc1573b5d473aa6d955c88",
  "hash": "a88545ba0075c11ad3898eca07b32978b0bc9a06cad5923cf1df90478f61c2ca"
}
