{
  "seq": 32,
  "id": "PTD-0032",
  "type": "decision",
  "timestamp": "2026-06-22T15:30:00Z",
  "actor": "builder-agent",
  "summary": "P2 ROADMAP — CODE_OF_CONDUCT.md (+ EN): канонический кодекс поведения (GitHub Community). Вынесен из CONTRIBUTING в полный файл: стандарты, приватность заявителей/подопечных, КОНСТИТУЦИОННЫЕ РЕЛЬСЫ КАК ЧАСТЬ ПОВЕДЕНИЯ (нарушение рельс безопасности = нарушение кодекса), каналы сообщения и эскалация людьми (не агентом, ст. 9), апелляция (ANTI-ABUSE), атрибуция Contributor Covenant 2.1. Documentation-агент зелёный, run_all 8/8. TESTNET-ONLY.",
  "refs": [
    "CODE_OF_CONDUCT.md",
    "CODE_OF_CONDUCT.en.md",
    "CONTRIBUTING.md",
    "README.md",
    "REPO-STRUCTURE.md"
  ],
  "payload": {
    "decision": "P2 ROADMAP (качество/прозрачность) — добавлен CODE_OF_CONDUCT.md (+ EN CODE_OF_CONDUCT.en.md): канонический кодекс поведения, который GitHub распознаёт на вкладке Community. Вынесен из краткой секции CONTRIBUTING в отдельный полный файл: обязательство сообщества (harassment-free), стандарты (здоровое/недопустимое поведение), приватность заявителей и людей, которым помогает фонд, КОНСТИТУЦИОННЫЕ РЕЛЬСЫ КАК ЧАСТЬ ПОВЕДЕНИЯ (нарушение рельс безопасности = нарушение кодекса: непрозрачность, протаскивание реальных средств/mainnet/ключей в обход TESTNET-first, обход голосования 1 человек=1 голос, обещания доходности/пирамида), область применения, каналы сообщения о нарушении (несенситивное — issue; сенситивное — приватно, security@/conduct@ после настройки почты), реакция/эскалация людьми (не агентом, ст. 9), путь апелляции (ANTI-ABUSE), атрибуция Contributor Covenant 2.1. Краткая секция CONTRIBUTING(.en) теперь ссылается на канонический файл. Documentation-агент зелёный (48 публичных доков, пары/переключатель/ссылки), run_all 8/8. TESTNET-ONLY.",
    "rationale": "INBOX оператора пуст → режим саморазвития: взят верхний выполнимый открытый пункт ROADMAP. Открытый P0 (Этап 5, часть 4 — публичный testnet) заблокирован оператором (сеть/RPC/адреса хранителей), поэтому верхний выполнимый — P2 «CODE_OF_CONDUCT.md (+EN)», прямо предложенный сессией 34 при сдаче CONTRIBUTING. GitHub распознаёт канонический CODE_OF_CONDUCT и показывает его в профиле Community Standards — это повышает доверие и открытость публичного-блага-проекта и даёт стороннему человеку явные правила безопасного участия. Кодекс усиливает рельсы: формулирует нарушение рельс безопасности как нарушение поведения, снижая риск попыток обойти прозрачность/голосование/TESTNET-first.",
    "deliverables": [
      "CODE_OF_CONDUCT.md (RU) — канонический кодекс: обязательство, стандарты, конституционные рельсы как часть поведения, область, сообщение о нарушении, реакция/эскалация людьми, апелляция, атрибуция",
      "CODE_OF_CONDUCT.en.md (EN-зеркало) — полный перевод той же структуры; переключатель [Русский]·[English]; ссылки ведут на EN-версии доков",
      "CONTRIBUTING.md / CONTRIBUTING.en.md — краткая секция «Кодекс поведения» теперь ссылается на канонический файл",
      "README.md / README.en.md — CODE_OF_CONDUCT добавлен в карту доков (после CONTRIBUTING)",
      "REPO-STRUCTURE.md / REPO-STRUCTURE.en.md — CODE_OF_CONDUCT внесён в таблицу файлов корня"
    ],
    "rails": [
      "общественное благо, НЕ инвестиция: кодекс прямо называет обещания доходности/пирамиду недопустимым поведением (PRINCIPLES.md)",
      "нарушение рельс безопасности = нарушение кодекса: непрозрачность, реальные средства/mainnet/ключи в обход TESTNET-first, обход голосования 1 человек=1 голос",
      "решения по нарушениям принимают ЛЮДИ (хранители/сопровождающие), не агент: AI только подсвечивает (ст. 9)",
      "приватность: запрет публиковать перс. данные участников и тем более людей, которым помогает фонд",
      "двуязычность RU↔EN в одном коммите; Documentation-агент зелёный; run_all 8/8",
      "пульс неприкосновенен: loop.sh/report.sh/.env/logs не тронуты"
    ],
    "status": "adopted",
    "spec": "docs/PRINCIPLES.md",
    "roadmap_item": "P2 — качество и прозрачность: CODE_OF_CONDUCT.md (+EN)"
  },
  "prev_hash": "5474493295d4308f1c72d574466c6c8cd694bf7e33b38815ce64d19d1231fe8d",
  "hash": "a43dcdcbd5b0fd48b15ce7829e2949c0d58d718fdbb45fe42b15c1a530920118"
}
