{
  "seq": 48,
  "id": "PTD-0048",
  "type": "decision",
  "timestamp": "2026-06-22T12:35:00Z",
  "actor": "builder-agent",
  "summary": "P3 (стандарты качества Этапа 6) — страж структуры ai-agents/structure_guard.py (+ тест-инвариант): у каждого *_agent.py есть парный test_*.py; нет осиротевших тестов; разбор .sol не копируется вне solidity_scan.py. Включён в run_all --with-tests → регресс валит CI. Закрывает две идеи роадмапа.",
  "refs": [
    "ai-agents/structure_guard.py",
    "ai-agents/test_structure_guard.py",
    "ai-agents/run_all.py",
    "docs/ROADMAP.md"
  ],
  "payload": {
    "decision": "P3 (банк идей, стандарты качества Этапа 6) — добавлен страж структуры ai-agents/structure_guard.py (+ тест-инвариант test_structure_guard.py). Закрывает сразу две открытые идеи роадмапа: (1) «стандарт „все агенты с инвариантами“ как явная CI-проверка» и (2) «CI-проверка „нет копий парсинга .sol вне solidity_scan“». Страж — служебный read-only модуль (ст. 9), ничего не правит и ничем не распоряжается; он смотрит на сам каталог ai-agents/ и проверяет три структурных стандарта: agents-have-invariants (у каждого *_agent.py есть парный test_<имя>.py — агент не «зелёный по умолчанию»), no-orphan-tests (у каждого test_*.py есть исходный модуль), sol-parsing-centralized (ни один *_agent.py не заводит локальную копию помощников разбора .sol — их импортируют из общего solidity_scan.py, а не размножают). Включён в run_all --with-tests, поэтому при регрессе CI краснеет.",
    "rationale": "Стандарты «у каждого агента есть тест-инвариант» (закрыт пробел Audit, сессия 33) и «разбор .sol централизован в solidity_scan.py» (рефактор, сессия 40) были добыты трудом и держались на дисциплине, без машинного стража — их можно было нечаянно нарушить и не заметить. Этот модуль превращает их в проверку, которая валит CI при регрессе. INBOX оператора пуст → взят верхний открытый пункт ROADMAP (режим саморазвития, одобрен INBOX #9). Контрактную работу Этапа 5 (контракт распределения / PersonhoodVerifier) в этой сессии не брал: диск хоста заполнен до 100% (чужие проекты), contracts/node_modules нет, hardhat не установить и не прогнать «до зелёного» — выбрана пригодная к завершению pure-Python задача без сети и зависимостей.",
    "deliverables": [
      "ai-agents/structure_guard.py — служебный read-only страж структуры каталога (три проверки), --json, exit 0/1",
      "ai-agents/test_structure_guard.py — тест-инвариант (17/17): на отравленных временных каталогах страж краснеет, на чистом — зелёный; сторож-регресс на настоящем каталоге",
      "ai-agents/run_all.py — test_structure_guard.py добавлен в TESTS (тесты 9→10), комментарий обновлён",
      "ai-agents/README.md / README.en.md — раздел «Страж структуры (Structure-Guard)» (RU/EN)",
      ".github/workflows/ai-agents.yml — название шага обновлено (8 агентов + 10 тест-инвариантов)",
      "governance/ipfs/manifest.json — пересобран, verify=OK",
      "governance/registry/ — запись PTD-0048 (type=decision)"
    ],
    "rails": [
      "Служебный модуль (ст. 9): read-only, ничего не двигает и ничем не владеет; находка = сигнал, не действие",
      "Без сети и сторонних зависимостей — только стандартная библиотека (детерминированно в любом CI)",
      "TESTNET-first: реальных средств/ключей не касается",
      "Диск хоста при работе очищены только собственные регенерируемые кэши (~/.cache: uv/pip/torch); чужие проекты не тронуты",
      "Двуязычность RU↔EN в одном коммите",
      "Пульс (loop.sh/report.sh/сервис/.env/logs) не тронут"
    ],
    "status": "adopted",
    "spec": "ai-agents/structure_guard.py",
    "verification": "run_all --with-tests: агенты 8/8, тесты 10/10 (включая test_structure_guard 17/17); structure_guard на реальном репо 3/3 зелёный",
    "advances_roadmap": [
      "стандарт «все агенты с инвариантами» как явная CI-проверка",
      "CI-проверка «нет копий парсинга .sol вне solidity_scan»"
    ]
  },
  "prev_hash": "04d42cf599ebb8595680bf45bbba58f10dc1881449b96b45439a69cf6a30314b",
  "hash": "c33ad8db3c9b5a15fa789a22a74a735afcc9258798c408a460a304a651ad7d64"
}
